<?xml version="1.0" encoding="UTF-8" ?>
<users  xmlns:xsi="http://www.w3.org/2001/XMLSchema-instance"
        xmlns="http://jd02.subach.it/somestring"
        xsi:schemaLocation="http://jd02.subach.it/somestring users.xsd"
>
        <user>
            <login>VasyaP</login>
            <email>VasyaP@mail.ru</email>
            <password>qwerty</password>
            <ads>
                <ad>
                    <description>
                        Good apartments
                    </description>
                    <adress>
                        Lenina, 1
                    </adress>
                    <floor>2</floor>
                    <rooms>3</rooms>
                    <price>9999</price>
                    <area>69</area>
                </ad>
                <ad>
                    <description>
                        Small apartments
                    </description>
                    <adress>
                        Khalturina, 15
                    </adress>
                    <floor>1</floor>
                    <rooms>1</rooms>
                    <price>5555</price>
                    <area>29</area>
                </ad>
            </ads>
        </user>
        <user>
            <login>PetyaV</login>
            <email>PetyaV@mail.ru</email>
            <password>asdfgh</password>
            <ads>
                <ad>
                    <description>
                        New apartments
                    </description>
                    <adress>
                        Kirova, 3
                    </adress>
                    <floor>10</floor>
                    <rooms>5</rooms>
                    <price>1200000</price>
                    <area>150</area>
                </ad>
            </ads>
        </user>

    </users>